"product_id","name","price","tagline","image_url","additional_images","description","packaging_capsules_or_grams","packaging_doses_per_package","recommended_intake","contraindications","additional_advice","research_note_text","research_note_url","about_title","about_description","effects_json","benefits_json","ingredients_json","faq_json","manufacturer","application_type","inventory","goals","target_profile","protocol_hint","synergy_products","safety_warnings"
"Уникален идентификатор на продукта (напр. prod-omega-3). Само малки букви, цифри и тирета. Не се променя след създаване.","Пълно търговско наименование на продукта.","Продажна цена в евро (число с до 2 десетични знака, напр. 29.99).","Кратък слоган/мото на продукта (до 100 знака).","URL на основното изображение на продукта (препоръчителен размер 800x800 px).","URL адреси на допълнителни изображения, разделени с вертикална черта | (pipe).","Кратко описание на продукта (показва се в списъка с продукти).","Количество в опаковка (напр. ""60 капсули"", ""500 мл"").","Брой дози в опаковка (напр. ""30 дози"").","Препоръчителен начин и честота на прием.","Предупреждения и противопоказания за употреба.","Допълнителна информация, съвети и препоръки.","Текст на научния/изследователски източник.","URL на научния/изследователски източник.","Заглавие на секцията ""За продукта"".","Подробно описание в секцията ""За продукта"".","Масив с ефекти в JSON формат. Пример: [{""label"":""Енергия"",""value"":85},{""label"":""Фокус"",""value"":70}]. Стойността е число от 0 до 100.","Масив с ползи в JSON формат. Пример: [{""icon"":""✓"",""title"":""Заглавие"",""description"":""Описание""}].","Масив от съставки в JSON формат. Пример: [{""name"":""Магнезий"",""amount"":""300мг"",""benefit"":""Подкрепя мускулите""}].","Масив от въпроси/отговори в JSON формат. Пример: [{""question"":""Кога?"",""answer"":""Сутрин.""}].","Наименование на производителя.","Тип приложение: Injectable | Intranasal | Topical | Oral | Injectable / Oral / Topical","Наличен брой единици (цяло число >= 0).","Цели/ефекти, разделени с запетая (напр. ""anti-aging, recovery, cognitive"").","Описание на идеалния потребителски профил.","Технически насоки за протокол на приложение (за специалисти).","ID-та на синергични продукти, разделени с запетая (напр. ""prod-semax, prod-selank"").","Предупреждения за безопасност (за вътрешна употреба)."
"prod-collagen-beauty","Collagen Beauty Complex","49.90","Морски колаген + хиалуронова киселина – красота отвътре навън","https://raw.githubusercontent.com/Radilovk/otslabvai/main/images/products/product-1769480798581-IMG_20260127_042603.jpg","","Collagen Beauty Complex е премиална формула за дневна грижа отвътре навън, съчетаваща хидролизиран морски колаген тип I и III с хиалуронова киселина, коензим Q10, витамин C и астаксантин. Колагенът е основният структурен протеин на кожата – с напредване на възрастта производството му намалява с около 1 % годишно, което води до поява на бръчки, отпускане и загуба на еластичност. Тази синергична формула активно стимулира синтеза на нов колаген от клетъчно ниво, задържа влагата в дерма и епидермис и предпазва от оксидативен стрес, за да се насладите на видимо по-млада, сияйна и гладка кожа.","90 капсули","30 дози","Приемайте 3 капсули дневно след основното хранене с чаша вода. За оптимален ефект приемайте непрекъснато минимум 3 месеца. Резултатите са кумулативни – колкото по-дълго се приема, толкова по-устойчив е ефектът.","Не е подходящ при алергия към риба или морски дарове. Не се препоръчва за бременни и кърмачки без лекарски съвет. При прием на разредители на кръвта (варфарин) се консултирайте с лекар, тъй като витамин C може да влияе на усвояването им.","За максимален ефект поддържайте добра хидратация (2+ литра вода дневно), балансирана диета богата на антиоксиданти и използвайте слънцезащитен крем. Избягвайте тютюнопушенето – то разгражда колагена. Първите забележими ефекти – подобрена хидратация и свежест – се появяват след 3–4 седмици; пълна регенерация – след 3 месеца.","Клинично доказано: морски колаген подобрява еластичността на кожата с до 20 % след 8 седмици","https://pubmed.ncbi.nlm.nih.gov/?term=marine+collagen+skin+elasticity+hydration","Красотата идва отвътре","След 25-годишна възраст производството на колаген намалява с ~1 % годишно. До 40 години сме загубили около 15 % от колагена си – именно тогава бръчките и отпускането стават видими. Collagen Beauty Complex атакува проблема директно в основата, предоставяйки на тялото строителния материал, от който се нуждае, за да регенерира и подмлади кожата на клетъчно ниво. Морският колаген тип I и III се усвоява до 1.5 пъти по-добре от говеждия заради по-малките си молекули (по-ниско молекулно тегло).","[{""label"":""Клетъчна регенерация"",""value"":88},{""label"":""Хидратация и еластичност на кожата"",""value"":92},{""label"":""Защита срещу стареене"",""value"":85}]","[{""icon"":""🔬"",""title"":""КЛЕТЪЧНА РЕГЕНЕРАЦИЯ"",""description"":""Морският колаген доставя биодостъпни пептиди, които директно стимулират фибробластите на кожата да произвеждат нов колаген и еластин, намалявайки видимите признаци на стареене.""},{""icon"":""💧"",""title"":""ИНТЕНЗИВНА ХИДРАТАЦИЯ"",""description"":""Хиалуроновата киселина задържа до 1 000 пъти собственото си тегло вода, осигурявайки дълбока хидратация и намалявайки фините линии от дехидратация.""},{""icon"":""🛡️"",""title"":""АНТИОКСИДАНТНА ЗАЩИТА"",""description"":""Витамин C е незаменим кофактор при биосинтеза на колаген и мощен антиоксидант. Астаксантинът е до 550 пъти по-силен от витамин E – предпазва от UV увреждания и хронично възпаление.""}]","[{""name"":""Морски колаген тип I и III (хидролизиран)"",""amount"":""2 500 mg"",""benefit"":""Биодостъпни пептиди, стимулиращи синтеза на нов колаген и еластин в кожата""},{""name"":""Хиалуронова киселина (нативна)"",""amount"":""100 mg"",""benefit"":""Задържа огромни количества вода в клетките – намалява бръчките и сухотата""},{""name"":""Витамин C (аскорбинова киселина)"",""amount"":""200 mg (222 % ПДП)"",""benefit"":""Кофактор при синтеза на колаген и мощен антиоксидант""},{""name"":""Биотин (Витамин B7)"",""amount"":""5 000 mcg"",""benefit"":""Укрепва косата, ноктите и поддържа защитната бариера на кожата""},{""name"":""Коензим Q10 (убихинон)"",""amount"":""50 mg"",""benefit"":""Захранва клетките с енергия и намалява признаците на фотостареене""},{""name"":""Астаксантин (от Haematococcus pluvialis)"",""amount"":""4 mg"",""benefit"":""До 550× по-силен антиоксидант от витамин E – предпазва от UV и оксидативен стрес""}]","[{""question"":""Кога ще видя резултати?"",""answer"":""Подобрена хидратация и свежест – след 3–4 седмици. Намаляване на бръчките и подобрена еластичност – след 2–3 месеца редовен прием.""},{""question"":""Подходящ ли е само за жени?"",""answer"":""Не. Колагенът е полезен за всички – при мъжете подпомага здравето на ставите, сухожилията и кожата. Формулата е подходяща за мъже и жени над 25 години.""},{""question"":""Мога ли да го комбинирам с мултивитамини?"",""answer"":""Да. Проверете общия дневен прием на витамин C и биотин, за да не надвишавате значително препоръчителните дози при комбинация с мултивитамини.""},{""question"":""Каква е разликата между морски и говежди колаген?"",""answer"":""Морският колаген има по-малки молекули (по-ниско молекулно тегло), което осигурява до 1.5 пъти по-добра биодостъпност. Освен това е по-подходящ за хора с чувствителност към говеждо месо.""}]","Premium Nutrition","Oral","30","anti-aging, skin-health, regeneration","Жени и мъже над 25 години, загрижени за красотата и здравето на кожата, желаещи да забавят видимите признаци на стареене и да поддържат еластична, хидратирана кожа.","ПРИЕМ: 3 капсули след основно хранене (обяд или вечеря) с чаша вода. ПРОДЪЛЖИТЕЛНОСТ: Минимум 3 месеца непрекъснат прием за оптимални резултати. ВАЖНО: Ефектите са кумулативни.","prod-resveratrol-q10, prod-detox-beauty","ПРОТИВОПОКАЗАНИЯ: Не при алергия към риба/морски дарове. Не за бременни и кърмачки без лекарски съвет. При варфарин – консултация с лекар. ВНИМАНИЕ: Не е лекарствено средство."
"prod-resveratrol-q10","Resveratrol + Q10 Anti-Age","54.90","Клетъчна защита и митохондриална енергия – щит срещу времето","https://raw.githubusercontent.com/Radilovk/otslabvai/main/images/products/product-1769480798581-IMG_20260127_042603.jpg","","Resveratrol + Q10 Anti-Age е мощна синергична формула, съчетаваща ресвератрол 500 mg от Polygonum cuspidatum, убихинол (активна форма Q10) 200 mg, алфа-липоева киселина и OPC от гроздови семки. Ресвератролът активира протеините-сиртуини (SIRT1) – „гените на дълголетието"", а Q10 зарежда митохондриите с АТФ. Заедно образуват многопластова защита на клетъчно ниво: потискат хроничното микровъзпаление, неутрализират свободните радикали и насърчават клетъчния ремонт, забавяйки биологичното стареене.","60 капсули","30 дози","Приемайте 2 капсули дневно с основно хранене (обяд или вечеря), тъй като Q10 се усвоява най-добре с хранителни мазнини. Препоръчителен непрекъснат курс: 3–6 месеца.","Не е подходящ за бременни и кърмачки. При прием на антикоагуланти (варфарин) – задължителна консултация с лекар. Ресвератролът може да взаимодейства с лекарства, метаболизирани от CYP3A4. При хормонозависими тумори – консултация с онколог преди употреба.","Q10 (убихинол) се усвоява до 2–3 пъти по-добре от убихинон. За усилен ефект добавете умерена физическа активност и диета, богата на цветни зеленчуци, горски плодове и зехтин. Продуктът е особено препоръчителен при прием на статини (за холестерол), тъй като статините намаляват естествените нива на Q10.","Ресвератролът активира SIRT1 – ключов протеин за клетъчна регенерация и дълголетие","https://pubmed.ncbi.nlm.nih.gov/?term=resveratrol+sirtuin+anti-aging+longevity","Науката на дълголетието","Resveratrol + Q10 Anti-Age действа на клетъчно ниво, справяйки се с двете основни причини за биологичното стареене: оксидативния стрес и митохондриалната дисфункция. Ресвератролът „казва"" на гените ни да активират защитните механизми, а Q10 буквално захранва клетките с енергия за ефективен ремонт и регенерация. Алфа-липоевата киселина е универсален антиоксидант – активен едновременно в водна и мастна среда, и регенерира витамините C и E за многократна употреба.","[{""label"":""Защита срещу клетъчно стареене"",""value"":90},{""label"":""Клетъчна регенерация и обновяване"",""value"":85},{""label"":""Детокс и антиоксидантна защита"",""value"":88}]","[{""icon"":""🧬"",""title"":""АКТИВИРАНЕ НА ГЕНИТЕ НА ДЪЛГОЛЕТИЕТО"",""description"":""Ресвератролът активира SIRT1 и AMPK – протеини, свързани с дълголетието. Стимулира автофагията (клетъчното самопочистване) и забавя процесите на клетъчно стареене.""},{""icon"":""⚡"",""title"":""МИТОХОНДРИАЛНА ЕНЕРГИЯ"",""description"":""Q10 (убихинол) е незаменим за производството на АТФ в митохондриите. С напредване на възрастта нивата на Q10 намаляват – тяхното попълване директно подобрява клетъчната енергия и ремонта.""},{""icon"":""🛡️"",""title"":""МНОГОПЛАСТОВА АНТИОКСИДАНТНА МРЕЖА"",""description"":""Ресвератрол + Q10 + алфа-липоева киселина + OPC образуват синергична мрежа, неутрализираща свободните радикали едновременно в водна и мастна клетъчна среда.""}]","[{""name"":""Ресвератрол (Polygonum cuspidatum, 98 % транс-ресвератрол)"",""amount"":""500 mg"",""benefit"":""Активира SIRT1/AMPK – пътища за клетъчен ремонт и дълголетие""},{""name"":""Коензим Q10 (убихинол – активна форма)"",""amount"":""200 mg"",""benefit"":""Директно подобрява митохондриалната функция и производството на АТФ""},{""name"":""Алфа-липоева киселина (ALA)"",""amount"":""200 mg"",""benefit"":""Универсален антиоксидант в водна и мастна среда; регенерира витамини C и E""},{""name"":""Витамин E (d-алфа-токоферол)"",""amount"":""134 mg TE (895 % ПДП)"",""benefit"":""Защитава клетъчните мембрани от пероксидация""},{""name"":""Екстракт от гроздови семки (OPC 95 %)"",""amount"":""100 mg"",""benefit"":""Сред най-мощните природни антиоксиданти; подобрява микроциркулацията""}]","[{""question"":""Как ресвератролът помага срещу стареенето?"",""answer"":""Ресвератролът активира SIRT1 – ензим, свързан с удължаване на клетъчния живот, подобряване на митохондриалната функция и потискане на хроничното възпаление, което е основен двигател на стареенето.""},{""question"":""Защо убихинол, а не убихинон?"",""answer"":""Убихинолът е редуцираната, активна форма на Q10. С напредване на възрастта конверсията от убихинон намалява. Убихинолът осигурява до 2–3 пъти по-добра биодостъпност.""},{""question"":""Мога ли да приемам при прием на статини?"",""answer"":""Да – Q10 е особено препоръчителен при статини, тъй като те намаляват естествените нива на коензима. При антикоагуланти (варфарин) обаче ресвератролът може да засили ефекта им – консултирайте се с лекар.""},{""question"":""Колко дълго трябва да приемам продукта?"",""answer"":""Минимум 3 месеца за натрупване на ефективни нива на Q10 и ресвератрол в клетките. Идеалният курс е 6 месеца, след което може да се приема поддържащо.""}]","Bio Longevity Labs","Oral","25","anti-aging, regeneration, detox, cellular-renewal","Жени и мъже над 35 години, търсещи дългосрочна клетъчна защита, подобрена енергийност и забавяне на биологичното стареене. Особено подходящ при прием на статини.","ПРИЕМ: 2 капсули с основно хранене (обяд или вечеря) – с мазнини за оптимална усвояемост на Q10. ПРОДЪЛЖИТЕЛНОСТ: Минимум 3 месеца, оптимален 6 месеца. ВАЖНО: Не приемайте на гладно.","prod-collagen-beauty, prod-nmn-nad","ПРОТИВОПОКАЗАНИЯ: Не за бременни и кърмачки. При антикоагуланти (варфарин) – задължителна консултация с лекар. При хормонозависими тумори – консултация с онколог. ВНИМАНИЕ: CYP3A4 лекарствени взаимодействия."
